{
  "$schema": "../rulepack.schema.json",
  "id": "OIML_R76",
  "profile": "OIML",
  "version": "2006.1.2",
  "title": "OIML R 76-1:2006 Non-automatic weighing instruments - Metrological and technical requirements",
  "source": {
    "documents": [
      {
        "ref": "OIML R 76-1:2006 (E)",
        "file": "docs/standards/oiml/OIML_R76-1_2006.pdf",
        "url": "https://www.oiml.org/en/files/pdf_r/r076-1-e06.pdf"
      },
      {
        "ref": "OIML R 76-2:2007 (E)",
        "file": "docs/standards/oiml/OIML_R76-2_2007.pdf",
        "url": "https://www.oiml.org/en/files/pdf_r/r076-2-e07.pdf"
      }
    ],
    "clause_prefix": "R76-1"
  },
  "units": {
    "mass": "g",
    "temperature": "C",
    "tilt": "per_mille"
  },
  "scale_interval_form": {
    "clause": "R76-1 4.2.2.1",
    "mantissas": [
      1,
      2,
      5
    ],
    "note": "e and d shall be of the form 1, 2 or 5 x 10^k"
  },
  "accuracy_classes": [
    {
      "id": "I",
      "name": "Special accuracy",
      "display": "I",
      "clause": "R76-1 3.2 Table 3",
      "bands": [
        {
          "e_min_g": 0.001,
          "e_max_g": null,
          "n_min": 50000,
          "n_max": null,
          "min_capacity_e": 100
        }
      ],
      "notes": [
        "e < 1 mg is not normally feasible to test (Table 3 footnote *)",
        "n may be < 50 000 when d < 0.1 mg (3.4.4)"
      ]
    },
    {
      "id": "II",
      "name": "High accuracy",
      "display": "II",
      "clause": "R76-1 3.2 Table 3",
      "bands": [
        {
          "e_min_g": 0.001,
          "e_max_g": 0.05,
          "n_min": 100,
          "n_max": 100000,
          "min_capacity_e": 20
        },
        {
          "e_min_g": 0.1,
          "e_max_g": null,
          "n_min": 5000,
          "n_max": 100000,
          "min_capacity_e": 50
        }
      ]
    },
    {
      "id": "III",
      "name": "Medium accuracy",
      "display": "III",
      "clause": "R76-1 3.2 Table 3",
      "bands": [
        {
          "e_min_g": 0.1,
          "e_max_g": 2,
          "n_min": 100,
          "n_max": 10000,
          "min_capacity_e": 20
        },
        {
          "e_min_g": 5,
          "e_max_g": null,
          "n_min": 500,
          "n_max": 10000,
          "min_capacity_e": 20
        }
      ]
    },
    {
      "id": "IIII",
      "name": "Ordinary accuracy",
      "display": "IIII",
      "clause": "R76-1 3.2 Table 3",
      "bands": [
        {
          "e_min_g": 5,
          "e_max_g": null,
          "n_min": 100,
          "n_max": 1000,
          "min_capacity_e": 10
        }
      ]
    }
  ],
  "class_aliases": {
    "IV": "IIII",
    "4": "IIII",
    "1": "I",
    "2": "II",
    "3": "III"
  },
  "grading_min_capacity_e": {
    "value": 5,
    "clause": "R76-1 3.2 (note below Table 3)",
    "note": "Min reduced to 5 e for grading instruments (postal, waste)"
  },
  "mpe_initial_verification": {
    "clause": "R76-1 3.5.1 Table 6",
    "unit": "e",
    "bands": {
      "I": [
        {
          "m_max_e": 50000,
          "mpe_e": 0.5
        },
        {
          "m_max_e": 200000,
          "mpe_e": 1.0
        },
        {
          "m_max_e": null,
          "mpe_e": 1.5
        }
      ],
      "II": [
        {
          "m_max_e": 5000,
          "mpe_e": 0.5
        },
        {
          "m_max_e": 20000,
          "mpe_e": 1.0
        },
        {
          "m_max_e": 100000,
          "mpe_e": 1.5
        }
      ],
      "III": [
        {
          "m_max_e": 500,
          "mpe_e": 0.5
        },
        {
          "m_max_e": 2000,
          "mpe_e": 1.0
        },
        {
          "m_max_e": 10000,
          "mpe_e": 1.5
        }
      ],
      "IIII": [
        {
          "m_max_e": 50,
          "mpe_e": 0.5
        },
        {
          "m_max_e": 200,
          "mpe_e": 1.0
        },
        {
          "m_max_e": 1000,
          "mpe_e": 1.5
        }
      ]
    },
    "boundary_rule": "upper bound inclusive: 0 <= m <= m_max_e[0]; m_max_e[i-1] < m <= m_max_e[i]"
  },
  "mpe_in_service_multiplier": {
    "value": 2,
    "clause": "R76-1 3.5.2"
  },
  "multi_interval_boundary": {
    "clause": "R76-1 3.3.3 Table 4",
    "rule": "Max_i / e_(i+1) >= min_ratio for every partial range except the last",
    "min_ratio": {
      "I": 50000,
      "II": 5000,
      "III": 500,
      "IIII": 50
    },
    "e_select_clause": "R76-1 3.3 (example) and A.4.4.3 note: e_i of the partial range containing the load; near zero e = e1"
  },
  "general_limits": {
    "rounding_error_elimination": {
      "d_over_e_gt": 0.2,
      "clause": "R76-1 3.5.3.2"
    },
    "changeover_step_e": {
      "value": 0.1,
      "clause": "R76-1 A.4.4.3"
    },
    "zero_setting_accuracy_e": {
      "value": 0.25,
      "clause": "R76-1 4.5.2",
      "auxiliary_device_limit_d": null
    },
    "tare_setting_accuracy_e": {
      "value": 0.25,
      "clause": "R76-1 4.6.3"
    },
    "zero_setting_range_pct_max": {
      "value": 4,
      "clause": "R76-1 4.5.1"
    },
    "initial_zero_setting_pct_max": {
      "value": 20,
      "clause": "R76-1 4.5.1"
    },
    "zero_setting_range_rules": {
      "clause": "R76-1 4.5.1 / A.4.2.1",
      "class_IIII_exempt_unless_commercial": true,
      "initial_wider_allowed_if_tested": true,
      "wider_clause": "R76-1 4.5.1 / A.4.4.2 (supplementary weighing test at the upper limit of the initial zero-setting range)"
    },
    "zero_return_e": {
      "value": 0.5,
      "clause": "R76-1 3.9.4.2"
    },
    "creep": {
      "clause": "R76-1 3.9.4.1",
      "short_total_e": 0.5,
      "short_15_30_e": 0.2,
      "short_minutes": 30,
      "long_hours": 4,
      "long_limit": "mpe",
      "max_temperature_variation_C": 2
    },
    "temperature_no_load": {
      "clause": "R76-1 3.9.2.3",
      "limit_e": 1,
      "per_delta_C": {
        "I": 1,
        "II": 5,
        "III": 5,
        "IIII": 5
      },
      "use_smallest_e": true
    },
    "temperature_range_default_C": {
      "low": -10,
      "high": 40,
      "clause": "R76-1 3.9.2.1"
    },
    "temperature_range_min_span_C": {
      "I": 5,
      "II": 15,
      "III": 30,
      "IIII": 30,
      "clause": "R76-1 3.9.2.2"
    },
    "static_temperatures": {
      "clause": "R76-1 3.9.2.1 / 3.9.2.2 / A.5.3.1",
      "ref_temperature_C": 20,
      "class_I_ref": "mean_of_limits",
      "extra_temperature_C": 5,
      "extra_if_low": {
        "op": "lte",
        "C": 0
      },
      "match_tolerance_C": 2,
      "match_tolerance_note": "Laboratory chamber tolerance used to recognise a test temperature (IEC 60068-2-1 / -2: +/- 2 K)",
      "max_rate_C_per_min": 1,
      "abs_humidity_max_g_m3": 20,
      "abs_humidity_applies": "high",
      "zero_tracking": "not in operation during the temperature test (A.4.4.1)"
    },
    "tilting": {
      "clause": "R76-1 3.9.1.1 / R76-2 9",
      "classes": [
        "II",
        "III",
        "IIII"
      ],
      "no_load_limit_e": 2,
      "no_load_limit_excluded_classes": [
        "II"
      ],
      "loaded_limit": "mpe",
      "default_limit_per_mille": 50,
      "no_load_excluded_unless_direct_sale": true
    },
    "power_supply": {
      "clause": "R76-1 3.9.3 / A.5.4",
      "mains_ac": {
        "lower_factor": 0.85,
        "upper_factor": 1.1
      },
      "external_dc": {
        "lower": "min_operating_voltage",
        "upper_factor": 1.2
      },
      "battery": {
        "lower": "min_operating_voltage",
        "upper_factor": 1.0
      },
      "vehicle_12v": {
        "lower": "min_operating_voltage",
        "upper_V": 16
      },
      "vehicle_24v": {
        "lower": "min_operating_voltage",
        "upper_V": 32
      },
      "test_loads": "10 e and a load between 1/2 Max and Max"
    },
    "significant_fault_e": {
      "value": 1,
      "clause": "R76-1 T.5.5.6 / 5.3.4"
    },
    "stable_equilibrium_e": {
      "value": 1,
      "clause": "R76-1 4.4.2 / A.4.12",
      "repeats": 5,
      "observe_seconds": 5,
      "zero_tare_limit_e": 0.25
    },
    "span_stability": {
      "clause": "R76-1 5.3.3 / B.4",
      "max_diff": "max(0.5 e, 0.5 |mpe|)",
      "min_measurements": 8,
      "initial_repeats": 5,
      "initial_range_limit_e": 0.1,
      "excluded_classes": [
        "I"
      ]
    },
    "damp_heat": {
      "clause": "R76-1 5.3.2 / B.2",
      "rh_high_pct": 85,
      "rh_ref_pct": 50,
      "ref_temperature_C": 20,
      "min_test_loads": 5,
      "excluded": {
        "classes": [
          "I"
        ],
        "class_II_e_below_g": 1
      }
    },
    "warm_up": {
      "clause": "R76-1 5.3.5 / A.5.2 / R76-2 10",
      "minutes": [
        0,
        5,
        15,
        30
      ],
      "disconnect_hours": 8,
      "limit": "|EL - E0| <= |mpe|"
    },
    "discrimination": {
      "clause": "R76-1 3.8 / A.4.8",
      "digital": {
        "extra_load_d": 1.4,
        "applies_if_d_g_gte": 0.005,
        "clause": "R76-1 3.8.2.2"
      },
      "analog": {
        "extra_load_mpe": 1.0,
        "min_displacement_fraction": 0.7,
        "clause": "R76-1 3.8.2.1"
      },
      "non_self": {
        "extra_load_mpe": 0.4,
        "clause": "R76-1 3.8.1"
      },
      "min_extra_load_g": 0.001,
      "test_loads": "three loads, e.g. Min, 1/2 Max and Max"
    },
    "sensitivity_mm": {
      "clause": "R76-1 6.1",
      "rules": [
        {
          "classes": [
            "I",
            "II"
          ],
          "min_displacement_mm": 1
        },
        {
          "classes": [
            "III",
            "IIII"
          ],
          "max_g_lte": 30000,
          "min_displacement_mm": 2
        },
        {
          "classes": [
            "III",
            "IIII"
          ],
          "max_g_gt": 30000,
          "min_displacement_mm": 5
        }
      ],
      "extra_load": "|mpe| at applied load, not less than 1 mg"
    },
    "repeatability": {
      "clause": "R76-1 3.6.1 / A.4.10",
      "limit": "|mpe|",